{
  "corpus_id": "dvaac",
  "critique_format_version": "0.1",
  "target": {
    "dvaac_release": "v0.1.4",
    "dvaac_release_commit": "e90a76daf9107871d1ff6a2d7c438d2b92709e53",
    "dvaac_doi": "10.5281/zenodo.20379817",
    "aac_verifier_release": "v0.2-candidate.7",
    "aac_verifier_commit": "689198d9c249a966a0abab6415ae8668efb512d9"
  },
  "reviewer": {
    "name": "",
    "affiliation_or_project": "",
    "contact": "",
    "reviewed_at": "YYYY-MM-DDTHH:MM:SSZ"
  },
  "scope": {
    "review_type": "fixture-realism",
    "fixture_ids": ["02-skill-md-prompt-injection"],
    "files_reviewed": [
      "fixtures/02-skill-md-prompt-injection/README.md",
      "fixtures/02-skill-md-prompt-injection/expected-findings.json",
      "fixtures/02-skill-md-prompt-injection/expected-aac.json"
    ],
    "commands_run": [
      "AAC_VERIFIER_PATH=../agent-assurance-case/verifier/verify.py python runner/verify_fixtures.py"
    ],
    "environment": "",
    "corpus_conformance_result": "not-run"
  },
  "findings": [
    {
      "finding_id": "DVAAC-CRITIQUE-001",
      "severity": "low",
      "category": "fixture-realism",
      "subject": {
        "type": "fixture",
        "ref": "02-skill-md-prompt-injection"
      },
      "title": "",
      "description": "",
      "evidence": "",
      "recommendation": "",
      "suggested_change_type": "docs"
    }
  ],
  "public_reproducibility": {
    "can_summarize_publicly": true,
    "redactions": "None",
    "reproduction_notes": ""
  },
  "claim_boundary": {
    "scanner_validation_claimed": false,
    "corpus_correctness_claimed": false,
    "endorsement_claimed": false
  }
}
